{
  "schemaVersion": "1.0",
  "name": "checkbox",
  "version": "0.0.1",
  "layer": "L0",
  "stability": "experimental",
  "files": {
    "checkbox.cem.json": "sha256:6f836fd6e12ea7404a49ca95d7741fe613298e0556fff581dc67f432ce2bdac1",
    "checkbox.css": "sha256:6871f7b967dff94a67067007c3371da5fac3604918edac2d0b86c7826b84da47",
    "checkbox.evidence.json": "sha256:5f76ae493a139c2402a6439ab3a367398585ad2854109d15b4359054b769d317",
    "checkbox.html": "sha256:e9747a2829c19bb15679c10deb75d99e937ff5876769acf71645e1a5a3d33302"
  },
  "bundleBudget": {
    "cssGzipBytes": 1536,
    "jsGzipBytes": 0
  },
  "capsule_hash": "sha256:120034cd4770864cf18b95cf91b32e98bd35c5a4194ebe2af179453b1f22dd63",
  "signature": {
    "keyId": "ashlar-local-dev-checkbox-2026-05-06",
    "algorithm": "ed25519",
    "value": "XAhO7tqioGOBiE+DHfKcHy+/IIymFEoe1478efwcZs02TRcmcXOTkpMoSZbZvD1axBcLXVFPDYkrjZQvr+jKBA=="
  }
}
